{"$id":"QK_GBFP8_HEAD64_GRANULARITY_SWEEP_EXECUTION_V20_BOUND_PATH_REPAIR_FRESH_L2_ACCEPTANCE_SCHEMA","$schema":"https://json-schema.org/draft/2020-12/schema","additionalProperties":false,"properties":{"acceptance_sha256":{"pattern":"^[0-9a-f]{64}$","type":"string"},"accepted":{"const":true},"action_id":{"const":"ace2:qk-gbfp8-base-v20:execute-once:a81f2916:additive-0001"},"artifact_kind":{"const":"qk_gbfp8_head64_granularity_sweep_execution_v20_bound_path_repair_fresh_l2_static_acceptance"},"claim_boundary":{"const":"STATIC_ONLY_NO_EXECUTION_AUTHORITY"},"core_manifest_closure_entries_sha256":{"pattern":"^[0-9a-f]{64}$","type":"string"},"decision":{"const":"ACCEPT_STATIC_PACKAGE"},"execution_package_file_sha256":{"pattern":"^[0-9a-f]{64}$","type":"string"},"fixture_report_file_sha256":{"pattern":"^[0-9a-f]{64}$","type":"string"},"official_payload_open_count":{"const":0},"official_target_process_starts":{"const":0},"required_disposition":{"const":"V20_BOUND_PATH_REPAIR_STATIC_PACKAGE_READY_FOR_FRESH_L2_NO_EXECUTION_AUTHORITY"},"reviewer_role":{"const":"Fresh-L2"},"runtime_namespace_file_count":{"const":0},"static_acceptance_grants_execution_authority":{"const":false},"v18_binding_table_file_sha256":{"const":"87ab3deb25f77d89b0797d72004b4436f9541987da13a42f44a2bff7f9fa9655"},"v19_terminal_file_sha256":{"const":"a81f2916fe3e5f2aa0489caee7d7a52ada1a8760b32ea7faf3a94bad6f4cb862"},"v20_executed":{"const":false}},"required":["acceptance_sha256","accepted","action_id","artifact_kind","claim_boundary","core_manifest_closure_entries_sha256","decision","execution_package_file_sha256","fixture_report_file_sha256","official_payload_open_count","official_target_process_starts","required_disposition","reviewer_role","runtime_namespace_file_count","static_acceptance_grants_execution_authority","v18_binding_table_file_sha256","v19_terminal_file_sha256","v20_executed"],"type":"object"}
