{"acceptance_sha256":"4f885abbc976bd2821770fe0f11b266ecb9b88fa4da85a3b0c96c5b3e605be48","accepted":true,"action_id":"ace2:qk-gbfp8-base-v20:execute-once:a81f2916:additive-0001","artifact_kind":"qk_gbfp8_head64_granularity_sweep_execution_v20_bound_path_repair_fresh_l2_static_acceptance","claim_boundary":"STATIC_ONLY_NO_EXECUTION_AUTHORITY","core_manifest_closure_entries_sha256":"82dde01daef9ad53274d633a441c58c1ab66af07751fc2cd5b4a7b5392c96767","decision":"ACCEPT_STATIC_PACKAGE","execution_package_file_sha256":"e1ab2b55dd07b6cfc9f8540d42eb3fd9b387cb57aadf0704933a29fe6c05c314","fixture_report_file_sha256":"f7dc3c28a6c463529aa28a90a4026cd98fe2dd800bf9187c5c709e9561b9198c","official_payload_open_count":0,"official_target_process_starts":0,"required_disposition":"V20_BOUND_PATH_REPAIR_STATIC_PACKAGE_READY_FOR_FRESH_L2_NO_EXECUTION_AUTHORITY","reviewer_role":"Fresh-L2","runtime_namespace_file_count":0,"static_acceptance_grants_execution_authority":false,"v18_binding_table_file_sha256":"87ab3deb25f77d89b0797d72004b4436f9541987da13a42f44a2bff7f9fa9655","v19_terminal_file_sha256":"a81f2916fe3e5f2aa0489caee7d7a52ada1a8760b32ea7faf3a94bad6f4cb862","v20_executed":false}
